title,score,comments,created,url,selftext,subreddit
Sealed by Morgott the Grace Given,1,0,2025-05-22 01:27:12,https://www.reddit.com/r/Eldenring/comments/1kseqmx/sealed_by_morgott_the_grace_given/,Hi im kinda lost now i manage yo stumble on somewhere that i thought was the next area only for it to be blocked by an invisible seal said sealed by Morgott the Grace Given. Was wondering what and where do i have to go now from. I dont mind spoilers,Eldenring
https://youtube.com/shorts/uSRxi0X4Jzo?si=BARxtVg8WRRQ0ncR,1,1,2025-05-22 01:27:11,https://www.reddit.com/r/HonkaiStarRail/comments/1kseqmp/httpsyoutubecomshortsusrxi0x4jzosibarxtvg8wrrq0ncr/,I will miss them ,HonkaiStarRail
This uno?!!,1,0,2025-05-22 01:27:11,https://i.redd.it/p8f6nq8ek82f1.jpeg,,SlimeKrewUG
I don't know how to mod my car?,1,0,2025-05-22 01:27:11,https://www.reddit.com/r/askcarguys/comments/1kseqmv/i_dont_know_how_to_mod_my_car/,"Please help me mod my Opel Ascona C Luxus 1.6L (1982)

I am not that familiar with modding when it comes to cars but I own the car that's in the title, and I want to start modifying it (not heavily).

It currently runs on 75hp, with a 4 gear transmission (will upgrade the trans to at least 5).

What are some recommendations? I was thinking of engine swapping to a C20LET 2.0L Turbocharged, though I can't find it anywhere yet.

I'm a Dutch student, so my budget isn't very high though I would love to hear some ideas and possibilities!

The car's in great condition, has basically no rust except for at the back window and front windshield underneath the window rubbers. I found someone who will fix this for me so then the car is in neat condition except for a few body marks that I will manage later on.

I appreciate the people that will respond to this!",askcarguys
Éducation : Les lauréats du concours Médiatiks récompensés,1,0,2025-05-22 01:27:11,https://lejournaldemayotte.yt/2025/05/22/education-les-laureats-du-concours-mediatiks-recompenses/,,Mayotte
Bertrand Russell’s Final Warning to the Future – A Message We Can’t Ignore,1,0,2025-05-22 01:27:11,https://youtube.com/shorts/z6Hq7ssunq4?si=kRqWzubCju-Kj3L6,"Bertrand Russell’s Final Message: Truth. Love. Survival.
In this rare clip, philosopher Lord Russell shares a message meant for future generations. His words on truth and compassion still cut through the noise today.
",peakysleeper
Summer Productivity,1,1,2025-05-22 01:27:10,https://www.reddit.com/r/teaching/comments/1kseqmn/summer_productivity/,"Summer break has finally arrived.

My first year teaching, I completely wasted my summer break. Laid around watching TV, playing video games, and generally being a lazy bum while telling myself it was fine to be enjoying the first extended break I had had in over a decade by doing nothing. I realized too late that I had wasted an opportunity to do so many more valuable things with my time.

The last two summers was better. Joined a gym to attend workout classes Monday through Friday (to force myself to get up and out of the house), made lots of pottery, followed a daily and weekly to do list that I mostly stuck to, worked a part time bartending job on the weekends. But I still didn't feel like I was being as productive as I could be with the valuable and ever fleeting 10 weeks that is the summer break. 

What do you all do to make your summer break feel worthwhile? How do you keep yourself accountable to goals you set? How do you even set those goals? 

Basically, how do you use your break to the fullest so you don't feel like you wasted it when it finally comes to an end? ",teaching
"I can help you with anything — name your price (marketing, editing, etc)",1,1,2025-05-22 01:27:10,https://www.reddit.com/r/phclassifieds/comments/1kseqmm/i_can_help_you_with_anything_name_your_price/,"
🎀 SERVICES I CAN OFFER
- Marketing needs and social media management (creating posts for your accounts, aligning brand themes)
- Help you manage your life (because I am good with managing mine lol)
- Accountability buddy !!! I have managed 3 before until they’re self-sufficient 
- Card readings and rituals + spell jars (for the psychicsss)
- Admin tasks / encoding
- Editing — canva or capcut, help with your vlogs and all!! (I have a tiktok and I used to be a youtube vlogger too)
- Writing (Essays, blogs, articles, school commissions, consistent honor student — I don’t use chatgpt when writing!!!)
- Commissions — mga powerpoints and layouting stuff, gotchu!
- Other tasks na you’re not sure sino lalapitan, or errands around MM / Cavite

Hi! I am a graduating pre-med student looking for a side hustle! I used to be active here on reddit with my account na nakalimutan ko na yung password lol—and I was a well-known reader around this sub last year!

📍ABOUT ME
- Graduating student, medtech
- Has experience with both local and international clients in virtual assistance, card readings, marketing, editing, writing, tutoring
- Canva and Capcut proficient
- Google suite savvy
- Madaldal and masipag

I have my portfolio with me just in case you wanna see some of my works 🤍 thank you so much for helping me graduate as well!

",phclassifieds
100 octane fuel straight from the pump thats NOT e85?,1,0,2025-05-22 01:27:10,https://www.reddit.com/r/InlandEmpire/comments/1kseqml/100_octane_fuel_straight_from_the_pump_thats_not/,"anybody know where i can buy higher octane fuel thats not e85? i dont want to special order a barrel of VP since i have nowhere to keep it and its kinda dangerous to just leave at my place. also kinda done with pouring the right amount of octane booster in my tank lol. i know the 76 by target in redlands used to have it but not sure if they still do since its been a while, but any locations is greatly appreciated ",InlandEmpire
Chirping noise during cold start,1,0,2025-05-22 01:27:10,https://v.redd.it/og5z7yzdk82f1,07 GX470. 117k. Wondering what that chirping noise is coming from. It happens only during cold start and goes away after truck has been running for about a minute. Seems like its coming from drive belt but im not mechanic. Belt seems to be in tact no obvious tears and seems to have good tension. Owned the truck about a month now and service history shows belt was replaced at 88k in 2013.,GXOR
I can’t get anywhere with recruiters (trying to DCO),1,0,2025-05-22 01:27:10,https://www.reddit.com/r/army/comments/1kseqmj/i_cant_get_anywhere_with_recruiters_trying_to_dco/,"I’m looking to start a career in the military and defense sector, as a military scientist. I want to direct commission into 71 bravo (research biologist) position. I have a PhD and am qualified, I’m am 36yo and am fit etc. None of the recruiters I’ve spoken to have any clue what to do with me. I’ve tried to get my application to higher ranked officers and they don’t return my call and also don’t know what I’m talking about. None of the people in recruiting seem to be aware that there are positions for people like me. I got into contact with a LTC who told me this would happen and he asked me to relay some recruiter zip codes to him while he tried to organize things on his end. I also tried reaching out to captains and higher at recruiter stations (but again, they don’t return call and or say they don’t know what I’m talking about). I haven’t heard back from the LTC in over a month and sent a follow up email 2 weeks ago. 

Also got turned down from the Navy for a similar position, because my degree didn’t exactly match up with the title (even though it says “or other related field” which I definitely am). 

I’m gonna try to go in person one more time and set up an appointment with a captain, to see if he can connect with my LTC contact, but I’m not hopeful. 

I’m always hearing that the military is hurting for folks to join… I wonder why! ",army
Unbelievable fps trick,1,0,2025-05-22 01:27:09,https://i.redd.it/1w8lrd1ek82f1.jpeg,"All credit goes to Mr Snarl on the forums. One hiccup I ran into was that there are two blocks ""terrain"" and ""theterrain"", the latter is the one he's talking about here. Went from 60 fps to 90 fps lol. ",BeamNG
Supplement scheduling?,1,0,2025-05-22 01:27:09,https://i.redd.it/ldutgz6xe82f1.jpeg,,LeopardGecko
I don't have a virtual camera on obs,1,1,2025-05-22 01:27:09,https://www.reddit.com/r/SteamDeck/comments/1kseqm6/i_dont_have_a_virtual_camera_on_obs/,"I know this looks irrelevant but I think this might be a steam deck only issue, and it's driving me insane",SteamDeck
When the set's been freshly cleaned 😍,1,0,2025-05-22 01:27:09,https://v.redd.it/enq4rhqdk82f1,"
Was going to post this to my IG story but didn't want to come across ostentatious so posting here to share with my lab diamond peeps!

My upgrade set is nearly a year old and hadn't been cleaned at all since I recieved it last June 😬. I'm very careful with it, take it off to wash hands, clean or do dishes, or apply lotion, and I don't sleep with it. Took it to the local jeweler to be inspected and they cleaned it for me. Obsessed with the sparkle. 

2.5 carat elongated cushion
",labdiamond
Sportster Knocking,1,0,2025-05-22 01:27:08,https://v.redd.it/2mp71d4bk82f1,Bike sat for three weeks and when I started it back up it was knocking. Sounds like it is the top end of the rear cylinder. I was wondering if it is oil pressure but oil appears to be flowing just fine. The knocking does speed up when I twist the throttle. Suggestions? ,sportster
Can anyone identify this company?,1,0,2025-05-22 01:27:08,https://i.redd.it/grvdo2vdk82f1.jpeg,"Can anyone identify the company on this badge. Supposedly a solar company. But he’s been to our neighborhood two nights in a row now and is freaking people out. Thank you in advance.
",SantaClarita
The cramped shelf; U.S. WW1 Bayonet Fencing Gear,1,1,2025-05-22 01:27:08,https://www.reddit.com/gallery/1kseqll,,Bayonets
meaning of dead cardinal,1,0,2025-05-22 01:27:08,https://www.reddit.com/r/spirituality/comments/1kseqls/meaning_of_dead_cardinal/,"i came home from work today and found a sad sight. a dead cardinal directly in front of my house on the street. i was reading up on seeing a dead cardinal meaning but the thing is this cardinal was run over, flat. do we think that changes the meaning and its possibly a negative symbol?",spirituality
If you're obese and have never ate a Nutella frosting and banana sandwich on chocolate chip bread you're aren't being fat correctly,1,0,2025-05-22 01:27:08,https://www.reddit.com/r/teenagers/comments/1kseqlp/if_youre_obese_and_have_never_ate_a_nutella/,"With raspberries or strawberries added 

My daily breakfast when obese ",teenagers
Question Level 1 - GAAP/IFRS Inventory write down,1,0,2025-05-22 01:27:08,https://www.reddit.com/r/CFA/comments/1kseqlx/question_level_1_gaapifrs_inventory_write_down/,"Hello CFAbros,

  
Can someone please clarify the below question to me? Per my understanding, IFRS writes down inventory as Lower of cost or NRV, and GAAP, Lower of cost or market. WHy are they saying that both GAAP /IFRS write down to NRV?

https://preview.redd.it/umyccpjck82f1.png?width=768&format=png&auto=webp&s=6cdfd7273bdc4c33c0b19ef7ba12b1d697f5fc31

  
",CFA
Unusual Options Activity,1,0,2025-05-22 01:27:08,https://www.reddit.com/gallery/1kseqm3,"Last Friday some of us noticed a trader bought 10,000 5/23 8.5P contracts for $300K.  Today it looks like that trader rolled their position into 8,000 6/6 8P contracts, for a $170K profit on the initial trade - while adding premium betting on continued downside (assuming these were ‘Buy to Open’).  $7.31 at expiration should be the breakeven price.

",KSSBulls
[23f] [chat] interesting opinions or your best argument?,1,0,2025-05-22 01:27:08,https://www.reddit.com/r/MeetNewPeopleHere/comments/1kseqly/23f_chat_interesting_opinions_or_your_best/,Looking to pass the time for a short while hearing people's opinions and hot takes. Fiances is up all night studying hard and I'm just chilling.        ,MeetNewPeopleHere
⚡️🛎️,1,0,2025-05-22 01:27:08,https://i.redd.it/9jxycetdk82f1.jpeg,,PhillyUnion
Should I Skip Fall Quarter?,1,0,2025-05-22 01:27:07,/r/TransferStudents/comments/1ksepg7/should_i_skip_fall_quarter/,,CollegeTransfer
"If Hitler's first name was not ""Adolf"" but something super common like ""John"", would people worldwide stop naming their children John, as happened with the name Adolph?",1,1,2025-05-22 01:27:07,https://www.reddit.com/r/NoStupidQuestions/comments/1kseqld/if_hitlers_first_name_was_not_adolf_but_something/,,NoStupidQuestions
"Ahh, much better!",1,0,2025-05-22 01:27:07,https://i.redd.it/33eni0udk82f1.jpeg,Does this gun not stand on its own? By its own design and merit? Without a big stupid character plastered over the side? Does the theme not represent the character enough? I’m pretty sure this is a glitch/bug but it looks SO much better this way…  I’ll be happy if it never resolves itself. Since this bug happened it’s clear the caricature is a separate layer or texture that a toggle could easily be created for.,CallOfDutyMobile
Bars/Breweries,1,0,2025-05-22 01:27:07,https://www.reddit.com/r/rva/comments/1kseqlb/barsbreweries/,"What are the best/safest bars or breweries to go to on a weekend night in Shockoe Bottom?

We're in our late 20s, prefer people around our age and like a chill/laid-back atmosphere where the drinks aren't outrageous.

I heard 17th-19th are fairly shooty this time of year when the bars close. So just mainly looking to not catch a stray.",rva
"Spn 2791 fmi 13 egr valve actuator no failsafe mode , motor off",1,0,2025-05-22 01:27:07,https://i.redd.it/qsxwf7pdk82f1.jpeg,"I got stuck with on 2014 cascadia with a dd13 showing only the code in the title that I'm unsure where to go next. I've put 2 egr actuators on it tried multiple ecus and mcms awell to no avail, the egr actuator will fail the calibration every time I had the correct ohms on all pins to the actuator. Need ideas for what else to try egr moves freely",DieselTechs
Kpop night saturday,1,0,2025-05-22 01:27:07,https://www.reddit.com/r/TorontoHangoutFriends/comments/1kseqlj/kpop_night_saturday/,"Would anybody want to go to this kpop night together on Saturday? I’m new to the city 29F, living downtown, and looking to make some friends!

https://www.eventbrite.ca/e/kpop-night-bar-serene-toronto-tickets-1343299457839",TorontoHangoutFriends
Can a freshly 14 year old date a freshly 16 year old,0,0,2025-05-22 01:27:06,https://www.reddit.com/r/NoStupidQuestions/comments/1kseql8/can_a_freshly_14_year_old_date_a_freshly_16_year/,"I’m quite unsure if this age gap is ok? I just recently turned 14 a few weeks ago and my crush is 15, turning 16 on the 28th. Would it be wrong if we ended up dating or liking eachother?

 I think it would be wrong or odd because one day (if we were dating) they‘d be 19, a legal adult, whilst im 17, a minor. even if i did turn 18, they‘d be turning 20 right after.

I would like to hear any opinions, but I think I simply must accept that I don’t have a chance with them. That’s okay, cause they’re a cool friend anyway!",NoStupidQuestions
Say no more,1,0,2025-05-22 01:27:06,https://www.reddit.com/gallery/1kseql0,,AnarchyChess
First grow of Golden Teachers [actives],1,0,2025-05-22 01:27:06,https://www.reddit.com/gallery/1kseqkt,"Looking pretty strong, imo ",MushroomGrowers
DISCUSSION,1,0,2025-05-22 01:27:05,https://www.reddit.com/r/TheWalkingDeadGame/comments/1kseqki/discussion/,When would Lee have died if he didn’t get bit in Savannah ,TheWalkingDeadGame
First goal with tots r9,1,1,2025-05-22 01:27:05,https://v.redd.it/m9oo3d6ck82f1,R5,EASportsFCMobile
Real or fake?,1,1,2025-05-22 01:27:05,https://www.reddit.com/gallery/1kseqkc,"friend was searching through his old collection and found this. can’t seem to find it anywhere, if it’s real, what’s the value on it?",IsMyPokemonCardFake
"Yo, what's good?",1,0,2025-05-22 01:27:05,https://i.redd.it/6ykgo0ndk82f1.jpeg,,Humanornot
Realized 3 credit cards have been opened/used under my name since 2023,1,0,2025-05-22 01:27:05,https://www.reddit.com/r/IdentityTheft/comments/1kseqkg/realized_3_credit_cards_have_been_openedused/,"Late to the game, but looks like the thief used my SSN / identity to open 3 credit cards, all with a minimum limit of $300 (is this oddly low?). I’ve been in the US on student visa so I personally never checked my SSN or credit till randomly this morning. I was able to find the thief’s current address and cell phone number after running a credit report on myself and seeing all the damage done. No money was directly taken from any of my accounts, they just opened the 3 credit cards and I suppose have an apartment under my name. I’ve contacted FTC to submit the report, will create a local police report this week, and froze / added fraud alerts. Will this thief soon realize I’m aware of what they’ve done and they will stop? They had created an email with my name on experian so clearly they’re aware of any account holds / freezes… Scared but also unsure what happens next here. ",IdentityTheft
Sushi/ Sasjimi recipes disappeared,1,0,2025-05-22 01:27:05,https://www.reddit.com/r/Palia/comments/1kseqkl/sushi_sasjimi_recipes_disappeared/,I had been playing the game for about a year when I stopped last December. I had found both the sushi and sashimi recipes back then and used them many times (I still have a few starred sushis left in my inventory.) I came back to play after the Elderwoods update and the recipes are gone. All the rest are there (although cooking is as borked as I remember) but the sushi and sashimi are not there. Has anyone else encountered this? I opened a ticket but with the amount of feedback they are getting now I'm guessing I'll hear back in two months.,Palia
Rate my island (Part 2),2,1,2025-05-22 01:27:05,https://i.redd.it/05ljk8r3k82f1.png,“And you’ll find. It’s just a bunch of plants! (A bunch of plants!x6)” -Talker and Persona,MySingingMonsters
"Liberals to make Nationals reform nightmare a reality after Coalition split. Labor’s environmental reforms could pass with support from the Liberal Party after the Coalition split, as Sussan Ley says she will work with the government on changes bitterly opposed by the Nationals",1,0,2025-05-22 01:27:05,https://www.reddit.com/gallery/1kseqkn,,friendlyjordies
Addressing the Stella subfandom being hated by everyone else. (My Response),1,0,2025-05-22 01:27:05,https://v.redd.it/7v5mhr2dk82f1,,hazbin
Buff ideas?,1,0,2025-05-22 01:27:05,https://www.reddit.com/r/BlackPantherMainsMR/comments/1kseqks/buff_ideas/,In my opinion i think they should buff his dash to 20 meters from 15 that would save a lot more people without making him op,BlackPantherMainsMR
Does anyone like strippers here?,1,1,2025-05-22 01:27:05,https://www.reddit.com/r/paypigs2/comments/1kseqko/does_anyone_like_strippers_here/,,paypigs2
Gonna be a great night!,1,0,2025-05-22 01:27:04,https://www.reddit.com/gallery/1kseqka,,drdabberofficial
Flash close on Margin?,1,0,2025-05-22 01:27:04,https://www.reddit.com/r/BitgetReddit/comments/1kseqk9/flash_close_on_margin/,"How come there’s no TP/SL or reverse button?
Anyone care to answer?

It’s only FLASH CLOSE",BitgetReddit
"the post below me is right, this sub needs more doctor appreciation",1,0,2025-05-22 01:27:04,https://www.reddit.com/r/playboicarti/comments/1kseqk7/the_post_below_me_is_right_this_sub_needs_more/,finally we getting some doctor appreciation in this sub ,playboicarti
Anyone on? Gooned and addicted,1,0,2025-05-22 01:27:03,https://www.reddit.com/gallery/1kseqjs,,irishtiktoknsfw
Bout to rage about the Playstation Stars cancelation...,1,0,2025-05-22 01:27:03,https://www.reddit.com/r/playstation/comments/1kseqjh/bout_to_rage_about_the_playstation_stars/,"So... What the hell. I get an email saying that they've been overwhelmed with how well recieved the Stars program was, so they're choosing to cancel it. Assholes. So basically, all it sounds like to me is another power trip by a big gaming company, which is getting SO old. Every console developer and lots of game developers are swinging their dicks around lately, and it's annoying. People like the service, so let's cancle it after only 3 years. Yeah. Way to show loyalty to your customers... Just had to vent. ",playstation
How lucky are we to have the Southern Alps in our backyard?,1,0,2025-05-22 01:27:03,https://i.redd.it/w4l20t32k82f1.jpeg,"Don't mind me, just feeding the algorithm monster.",SelwynDistrict
[Startup] Building an AI agent that finds B2B companies now adding a feature that pays affiliates for adding businesses,1,0,2025-05-22 01:27:03,https://www.reddit.com/r/startup/comments/1kseqjm/startup_building_an_ai_agent_that_finds_b2b/,"Hey everyone!

I’m currently building a tool called 2kai Agent, an AI-powered platform that helps people find B2B companies to reach out to ideal for lead generation, outreach campaigns, or sales research.

But I’m now working on a new feature I think some of you might find interesting: 👉 Affiliates can get paid for adding businesses to the platform.

**Here’s how it works:**

• Affiliates manually submit B2B company info (like name, website, contact email, etc.).

• Every time someone finds and unlocks a company you added, you get paid.

• Think of it like crowd-sourced data enrichment, but with real incentives.

I’ve already got payouts set up using Stripe Connect, and I’m currently figuring out the best way to manage submission quality and avoid spam.

The idea is to create a win-win: People looking for leads get fresh data, and contributors get rewarded for helping build the dataset.

**Would love to hear your thoughts:**

• Would you find this kind of affiliate model motivating?

• What would make you want to contribute companies?

• Any red flags or features you’d want to see added?",startup
Simple ignition instructions,1,0,2025-05-22 01:27:03,https://www.reddit.com/gallery/1kseqju,"Input all images here and follow the instructions. Ignore the “four”, that is just a minimum threshold. Put them in a few at a time.",RSAI
Any recommendations to fix scratches?,1,0,2025-05-22 01:27:03,https://www.reddit.com/r/askcarguys/comments/1kseqk0/any_recommendations_to_fix_scratches/,"My car has a few minor scratches and some that just passed the paint and peirced the metal. They’re quite small and not really noticeable unless you look for it; 

however it’s honestly an eyesore for me and I’d like keeping my paint nice. I found some things on Amazon such as Meguiar’s ultimate compound, a touch up paint pen, and a turtle wax ceramic spray paint. 

Let me know if any of you guys have experience with these products or have better ones in mind. If it matters the cars’ paint is peral white. TYIA",askcarguys
Come on down y'all!,1,0,2025-05-22 01:27:03,https://i.redd.it/cz4x66a4k82f1.png,,IronFrontNC
Zoro fanart by me,2,0,2025-05-22 01:27:03,https://i.redd.it/ypeok62dk82f1.jpeg,,OnePiece
Hop around between Tavs?,1,0,2025-05-22 01:27:02,https://www.reddit.com/r/BaldursGate3/comments/1kseqjf/hop_around_between_tavs/,"Hey all! Just a curious question. I love my current Tav but sometimes I find myself wishing I had done other things differently, and I want to try a surge run. But I don’t want to totally give up on my current Tav, but is it ridiculous to swap between save files?",BaldursGate3
DPS Alert,1,0,2025-05-22 01:27:02,https://www.reddit.com/r/AlertVegas/comments/1kseqjd/dps_alert/,"DPS Alert 
 Motorist Assist 
IR15 N / RUSSELL RD; NB SO                                   
05/21/2025 06:22:09 PM",AlertVegas
"250522 BINI Jhoanna with Stacey, Michael Sager, and Emilio Daez | TikTok Story",2,0,2025-05-22 01:27:02,https://v.redd.it/kkffus6qj82f1,"Source: [https://vt.tiktok.com/ZSht82sE9/](https://vt.tiktok.com/ZSht82sE9/)

\---

Before commenting and making baseless accusations about the members involved in the issue, please make sure you've **read the** [**summary**](https://www.reddit.com/r/bini_ph/comments/1ki8ojk/a_summary_of_the_issue_involving_bini_colet/) on the issue, especially **Ethan David's** [**latest statement**](https://x.com/_ethandavidd/status/1922969326757269624).",bini_ph
Do you think doms going to leave liv for Roxanne he left rhea for liv,1,0,2025-05-22 01:27:01,https://v.redd.it/hfw2bf0sx62f1,,WWEMemes
Noticiario Nocturno - Ataque contra funcionarios de CDMX fue una agresión directa (21/05/2025),1,0,2025-05-22 01:27:01,https://www.youtube.com/watch?v=t_p_ipfiK58,,Mexico_Videos
[The Amazing World of Gumball],1,1,2025-05-22 01:27:01,https://i.redd.it/gv4qra5dk82f1.jpeg,,explainthisscreen
what’s the best i can do?,1,1,2025-05-22 01:27:00,https://www.reddit.com/r/AusVisa/comments/1kseqio/whats_the_best_i_can_do/,"I’m in my final semester of Bachelor’s in IT. The market is really tough and I will only get 2 years of 485 to figure things out which is really tight. 
Is it best for me to study Masters in the same field and extend my student visa or just take the risk? 
2 years will be really tight to figure things out specially in today’s market. 
I don’t expect to get 189,190 as it’s really tough and I don’t have enough time to collect the maximum points. 
What are the chances of getting 482(employer sponsorship)? 

Any help will be highly appreciated. 
Thanks in advance. ",AusVisa
Bald spots that my cats are scratching,1,1,2025-05-22 01:27:00,https://www.reddit.com/gallery/1kseqin,"The first three pics are of my 1 year old cat on her neck and the second two pics are of my four year old cat on his elbow (both fixed, both exclusively indoors). I noticed these rash-like bald spots on them and they are scratching at them. What could have caused these? What can I do to help them? Thank you all in advance. ",CATHELP
