title,score,comments,created,url,selftext,subreddit
Ratio Of Death.,1,1,2025-05-22 01:27:48,https://i.redd.it/ukdu6m4ik82f1.jpeg,He made fun of the new Gumball season 7 teaser,BlueRyai
Pokémon’s Biggest Scan,1,0,2025-05-22 01:27:47,https://www.reddit.com/r/YoutubePromotionn/comments/1kser21/pokémons_biggest_scan/,https://youtu.be/yHkSxgxpL-U?si=NQqLxvpoDcpDkr0g,YoutubePromotionn
I wear disposable gloves when i smoke so i don’t stain my fingers,1,1,2025-05-22 01:27:47,https://www.reddit.com/r/Cigarettes/comments/1kser20/i_wear_disposable_gloves_when_i_smoke_so_i_dont/,,Cigarettes
No agents (buying or selling). Home inspection and loan related advice.,1,1,2025-05-22 01:27:47,https://www.reddit.com/r/FirstTimeHomeBuyer/comments/1kser1z/no_agents_buying_or_selling_home_inspection_and/,"The buyer and seller both don’t have agents. The showing was done and the seller is agreeing for a home inspection. Both can sit either with a lawyer or a realtor with a flat fee and get the paperwork done but that’s not the worry. 

Buyer is curious on how to go about home inspections and finding a loan officer. 

Usually the officers are working with certain companies and push you to work with their team ( not too much sure about the whys but that seems to be the trend). Is it possible that a loan officer would tell me what loan they can get me and give me quotes? If I go to multiple officers would they all do a hard pull multiple times and bring my credit score down? I am above 720 ( nearing 800 something last time I checked last year). 

How to hire a thorough inspector as I’ve read that those with the realtor usually just go through the house not properly checking and just write some basic stuff ( that maybe false stat so correct me if it is please) to get it passed and get their commission. ",FirstTimeHomeBuyer
Safari zone 0,1,1,2025-05-22 01:27:47,https://i.redd.it/zoww983ik82f1.jpeg,Does anyone else miss customizable safari zones bc of this game? I found it really fun and I barely use any other safari zones besides the hgss one because the Pokémon and decorations are more interesting. Pic of a decoration I just did in a zone for the heck of it after not touching my game for a while. :) 0,PokemonHGSS
Selling house. Buyer's bank wants roof replaced.,1,0,2025-05-22 01:27:47,https://www.reddit.com/r/RealEstate/comments/1kser1w/selling_house_buyers_bank_wants_roof_replaced/,"We have cleared all buyer's home inspections and are under contract. Bank sent out 2 different roofers to inspect the roof. First guy says it needs to be replaced, second guy listed off some things like minor hail damage, peeling, not a good roof shingle for where we live, but didn't know if it needed replaced.

Our realtor is asking us to cover it with our insurance in full. I feel like our realtor needs to do her job and negotiate, at least foe buyer to pay half. We are first time home sellers and don't know if I am off base here. Would like insights on how to approach this. ",RealEstate
5$ Funko wall of your choice or bundle up,1,0,2025-05-22 01:27:47,https://i.redd.it/hby5eq0ik82f1.jpeg,"5$ a pop with low shipping!! 

https://www.whatnot.com/s/U4anw2sA",FunkoPopDeals
Can't upgrade my bloodweb???,1,0,2025-05-22 01:27:46,https://v.redd.it/906gbhthk82f1,"Does anyone know why I can't upgrade my blight???
I just wanna get his perks</3
I've tried restarting my game :(",deadbydaylight
Guitar teacher or me ?,1,0,2025-05-22 01:27:46,https://www.reddit.com/r/Guitar/comments/1kser1j/guitar_teacher_or_me/,"So im sorry if this is what is supposed to happen but I don't know so that's why I'm asking. So I went to my first lesson today. I sat down and waited, a good ten seconds ( doesn't seem long but in a room with someone you don't know feels like forever ) then I spoke up. He waited for me to ask questions. He was fantastic at explaining things to me but allways waited for me to ask him something. I thought it would Have started with him asking me "" what chords are you familiar with? "" or "" is there any songs you'd like to learn? "". I don't know if this is the usual but idk if I should keep going to him or go to another person?",Guitar
What guitar is this,1,1,2025-05-22 01:27:46,https://www.reddit.com/gallery/1kser1l,My great grandpa's old guitar. It has paint on it (not me) and me and my friend couldn't find an exact replica. All I know is that it's an epiphone and that the serial number is 60016,guitars
Can anyone explain how Syncrony’s credit works for Mattress Firm?,1,0,2025-05-22 01:27:46,https://www.reddit.com/r/Mattress/comments/1kser1m/can_anyone_explain_how_syncronys_credit_works_for/,"I bought a guitar from Sweetwater some years ago using Synchrony credit. It was supposed to be 0% interest for 48 months. I never missed a payment but discovered three months in they were charging me 30% interest. I was still within the 48 month period and never missed a payment. But for all three months they were charging me full interest from the start. My grandfather pod the remaining balance on his credit card and I paid him to remainder. He saved me from taking all that interest I shouldn’t have been paying. 

Now Mattress Firm wants to finance me for a mattress through Synchrony. They say it’s 72 months 0% interest. I’m afraid of the same thing happening here. I understand deferred interest, I can definitely pay this off within 72 months. I can honestly have it paid off within 24 months. But I don’t want to run into the same problem. 

I washed my hands of the problem I encountered with Sweetwater and just figured they lied to me. I never got an answer for what happened and ended up letting it go. 

How do these credit lines actually work? How do you do this without getting screwed? My sales person is no help, he’s had the job for two days. He called his manager six times for help while we were trying to go over financing. If I pay this thing off within the 72 months, and I don’t miss a payment, I should get 0% interest, right? I only get the full 72 months of interest if I miss a payment or don’t pay it off within the 72 months. 

So how did I get screwed into paying interest with Sweetwater? I need a bed, but I don’t use credit very often. I watched my parents get screwed because they were kinda irresponsible with credit. They screwed themselves. So I never got into credit very much. But as a result I don’t know much about it. ",Mattress
"Outjerked together by Sky Sports, Google News and Spurs",1,0,2025-05-22 01:27:46,https://i.redd.it/x7ibgy0ik82f1.png,,soccercirclejerk
HE COOKING????,1,0,2025-05-22 01:27:46,https://v.redd.it/zhrxck1ik82f1,,SunKenji
Newly Diagnosed,1,0,2025-05-22 01:27:45,https://www.reddit.com/r/breastcancer/comments/1kser1f/newly_diagnosed/,"My mom was recently diagnosed breast cancer and her likely treatment plan includes IV therapy, chemo and radiation after surgery. While she caught it in stage one, I’m wondering what to do to help her throughout her process. Are there things that can make chemo more comfortable?I have a very flexible work schedule and can work form her house/help her with things when needed and we also have a lot of family in town who are willing to help. 

We’re taking it step by step and so far have planned time off to help her after surgery, but trying to think of other things to help her. ",breastcancer
Don't see too much flank on here but would you pull up a chair for some fajitas?,1,0,2025-05-22 01:27:45,https://www.reddit.com/gallery/1kser1d,,steak
Toddler Anemic,1,0,2025-05-22 01:27:45,https://www.reddit.com/gallery/1kser1b,"I’m waiting to hear back from our ped who has been consulting with a hematologist but my toddler (recently 12 months) seems to have worsening anemia despite a daily iron supplement. 

Has anyone else gone through this? They did some bloodwork and ruled out some of the scary things but it’s getting worse and not improving despite 2ml of daily iron supplement. Little one also doesn’t drink much milk historically. 

We cook on cast iron, I provide citrus fruit with the iron supplement, little one loves spinach, eggs and red meat. 

Anything I should ask for? 

Historically another child also had anemia that was caused from a milk overconsumption and needed a blood transfusion, but I don’t think this is all that similar. ",Anemic
22F looking for chill friends to chat with,1,1,2025-05-22 01:27:45,https://www.reddit.com/r/MakeNewFriendsHere/comments/1kser17/22f_looking_for_chill_friends_to_chat_with/,"I’m 22 from Ottawa looking for some chill people to chat with. Nothing gross message me something interesting about yourself. I will not respond to just Hey. Fine with moving our chats over to discord I respond much faster there. 

I love cooking baking reading, writing, poetry, painting I like going for runs bike rides. I have a dog and a cat. Yes you can ask for pictures. I apologize if it takes me a while to respond I tend to get really busy and forget I have a phone. ",MakeNewFriendsHere
Best fluff fanfics?,1,0,2025-05-22 01:27:45,https://www.reddit.com/r/WingsOfFire/comments/1kser12/best_fluff_fanfics/,"Preferably on ao3. To give some ideas of what i like, here are some fanfics that I recently read and enjoyed (I'm looking for fics similar to them): floriography for idiots by solarfeather (does anyone know if this is canceled? hasn't updated in a bit), less than three by huikai, healed, and knight-errant by mist1lteinn",WingsOfFire
Post partial thyroidectomy question,1,0,2025-05-22 01:27:45,https://www.reddit.com/r/thyroidhealth/comments/1kser11/post_partial_thyroidectomy_question/,Random but I’m curious if anyone else has had changes in their skin or bowel movements after surgery? Getting random breakouts and not regular anymore. Not sure what to do to help. ,thyroidhealth
Confusion regarding biometric anf interview,1,1,2025-05-22 01:27:44,https://i.redd.it/b7rovzohk82f1.jpeg,"Hello good people help me to get it. Today  at morning I just have my biometric. Once I done with biometric recived email that bio is done, one hour later got another email that action is taken and again I log in my USCIS account and found step 3 (interview)  is checked marked. I mean how!!!. Does they going to approve me without interview or any mistake?? If you notice carefully it says 52 months wait for case decision. I didn’t get it.",USCIS
"I had a tax question: When you own a small business, is the salary you pay yourself an operating expense?",1,0,2025-05-22 01:27:44,https://www.reddit.com/r/smallbusiness/comments/1kser0m/i_had_a_tax_question_when_you_own_a_small/,"Just what the title says; I'm assuming it's an operating expense in the Wages line-item on an income statement.  My only concern is that a model someone posted on a forum actually shows it below the tax-expense line, which seems odd to me....",smallbusiness
Which state to buy a car in?,1,0,2025-05-22 01:27:44,https://www.reddit.com/r/whatcarshouldIbuy/comments/1kser0n/which_state_to_buy_a_car_in/,"Hey all, just got a job offer in Texas and now in the process of moving and getting a car. I'm currently based in Wisconsin with a NC driver's license (plus family lives there). Which of the three states is the best place to get a car? I'm not exactly sure how it works with taxes and all that. Also any recommendations for cars in any of the three states (around 15K? or less even) are greatly appreciated! Thank you!",whatcarshouldIbuy
"Meet Peggy, Liverpool FC's 93 year old superfan.",1,0,2025-05-22 01:27:44,https://www.bbc.co.uk/news/articles/clyqqdg4n9eo?at_link_id=D11F3C48-3635-11F0-878B-C50EE04EDCF8&at_campaign=Social_Flow&at_ptr_name=facebook_page&at_link_type=web_link&at_medium=social&at_campaign_type=owned&at_format=link&at_link_origin=BBC_Merseyside&at_bbc_team=editorial&fbclid=IwQ0xDSwKbXFxleHRuA2FlbQIxMQABHkk3CUO2uj0Laqt82x5q06cbdvltKByeOJAKA2ALQNOVnkCODIp7-yXyaabo_aem_z65OrW1rzzdHqL83bAhQ1w,,LiverpoolFC
🌺,1,0,2025-05-22 01:27:44,https://i.redd.it/yvu4xh0hk82f1.jpeg,,LatinaCheck
Coloring Anna panel from the manga,1,1,2025-05-22 01:27:44,https://www.reddit.com/gallery/1kser0u,,TooManyLosingHeroines
Scroll to the next image to read what I have to say don’t wanna write all that again. 🤣,1,0,2025-05-22 01:27:44,https://www.reddit.com/gallery/1kser0v,,CrestedGecko
What is this?,1,0,2025-05-22 01:27:44,https://www.reddit.com/r/Pixelary/comments/1kser0w/what_is_this/,This post contains content not supported on old Reddit. [Click here to view the full post](https://sh.reddit.com/r/Pixelary/comments/1kser0w),Pixelary
PED0 NA PROF NAMIN,1,1,2025-05-22 01:27:44,https://www.reddit.com/r/PinoyUnsentLetters/comments/1kser0y/ped0_na_prof_namin/,"Hi, itago niyo na lang ako sa pangalan na ""Mj"" 

I am a minor, studying at a catholic school. Ever since nag transfer ako dito sa catholic school na 'to, nanonormalize na ang bullying, pagnanakaw, at sexualizing. Lalo na ang mga ped0phile na mga teachers. Sa totoo lang gustong gusto ko na mag speak up about sa case na 'to, kaso nga lang wala ring magagawa ang Studeng Behavior Managemeng Office namin. 
Fastforward, pumunta na tayo sa topic na nalaman ko ang isang prof namin ay pedo. Mga bandang 2nd or 3rd quarter 'di na siya pumapasok. Nga pala, tawagin na lang natin siya na ""Teacher BK"", si teacher bk ay idescribe natin na. Mataba, may balbas at naka brace. mahilig siyang mag discuss tungkol sakaniyang mga personal experience, may one time na nagkwento rin siya tungkol sa kaniyang mga pet dogs na husky.

 
context:
nung una, approachable naman siya lalo na if may mga tanong and concerns kami, if di namin maintindihan ang lessons. Mahilig rin siya mag joke, pero patagal ng patagal. nagiging touchy na sya sa mga classmates ko, ang masaklap? nagpaiyak siya ng isang lalake naming classmate. observant talaga ako pagdating sa mga naka paligid sa akin, may instinct ako na mararamdaman ko if may alanganin o hindi. 


balik tayo kay ""teacher bk"", so ayun na nga. napansin ko na he's getting out of hand. Touchy na sya sa mga girls sa amin, habang sa boys naman minsan hindi nya pinapansin at minsan naman same goes by the girls pero may ibang vibe. fastforward, may isang araw na hindi na literal sya pumapasok, buti na lang may isang coor na nag subsitute sakanya. tawagin natin siyang ms ""Audrey"", mabait si ms audrey compered kay teacher bk, approachable at mahinhin. 


may isang nagtanong kay ms ""audrey"" kung bakit hindi na raw napasok si teacher bk, ang sabi? may sakit. nung una naman, naintindihan naming lahat. baka stress o nag uundergo ng therapy. pero patagal ng patagal, nahahalata ko na may something. 

WHY?? I was the first one to know in my class his image, kung paano siya magturo and SCANDAL. 

may grade 12 akong tropa na dating student ni teacher bk. He was worst and a big no no. Ped0phile siya, at malib0g. He even sends his n*de pics sa isang student niya. But evetually na take down rin .

Finally after a month, nalaman ko na hindi pala may sakit or nag uundergo ng therapy si teacher bk. He was kicked out of our school kasi nagdadate ng grade 10 student. 

Ayun lang and maraming salamat. ngayon naman ang problema ko this coming pasukan is kung paano iwasan nanaman ang isa pang ped0 na math teacher namin",PinoyUnsentLetters
Mars & Arcturus Star,1,0,2025-05-22 01:27:43,https://www.reddit.com/gallery/1kser0i,Celestron 60AZ Telescope.,telescopes
hi i have a question !,1,0,2025-05-22 01:27:43,https://www.reddit.com/r/doughboys/comments/1kser0g/hi_i_have_a_question/,"hi friends,
I am a new fan of dough boys. I know Mitch acts. I am very high, is this him in season 2 of “Kevin can go f himself”?!?!? THSTS MY BOY MIKE MITCHELL.
Pls lmk okay thanks about to enjoy my subway now, even tho Nick said it’s gross 🥲",doughboys
What is the lowest exam percentage you got?,1,0,2025-05-22 01:27:43,https://www.reddit.com/r/AskReddit/comments/1kser0e/what_is_the_lowest_exam_percentage_you_got/,,AskReddit
"Ganaste la lotería, ¿Qué es lo primero que dirías a los demás?",1,0,2025-05-22 01:27:43,https://www.reddit.com/r/preguntaleareddit/comments/1kser0c/ganaste_la_lotería_qué_es_lo_primero_que_dirías_a/,,preguntaleareddit
Best 3rd party (cheapish) wiper linkage for Cruze 2015?,1,0,2025-05-22 01:27:43,https://www.reddit.com/r/cruze/comments/1kser0b/best_3rd_party_cheapish_wiper_linkage_for_cruze/,"Hi, 2 years ago I hacked away at my driver side wiper ball joint thing since it popped off and wouldnt go back on with some metal wire.. 2 years later and it popped off again. I went in to do my super DIY repair and found that the actual joint / turny thing that the arm pushes was ceased shut with rust and everything else. I took the whole thing off and spayed it and then decided to hit it with a hammer and bamb it shattered.

So anyway I want to get a replacement linkage (with the bottom part) and found loads of makes on [amazon.ca](http://amazon.ca), anyone know which ones are the best (and i mean cheap best). Bonus pic of my f\*\*\* up, thanks:

https://preview.redd.it/9gf6zww9k82f1.jpg?width=2252&format=pjpg&auto=webp&s=1f3b923692aae698234389224cbc1577e2d9e8a2

",cruze
Most dangerous Jacksonville neighborhoods in 2025 based on violent crime statistics,1,0,2025-05-22 01:27:43,https://www.areavibes.com/jacksonville-fl/most-dangerous-neighborhoods/,Paxon #1,DuvalCounty
What 1:64 scale diecast cars have solid plastic or diecast windows?,1,0,2025-05-22 01:27:43,https://www.reddit.com/r/Diecast/comments/1kser05/what_164_scale_diecast_cars_have_solid_plastic_or/,"https://preview.redd.it/o95uxml8k82f1.jpg?width=1600&format=pjpg&auto=webp&s=35fd82666d94d647dae9f9905ad0f5cd43da54b3

These are old General Mills promo Nascar 1:64 diecast cars that came with General Mills products like cereal. I have also seem similar windows on Hot Wheels and Nascar promos from McDonald's Happy Meals. 

Are there others that are similar? ",Diecast
Waterpark NSV,1,0,2025-05-22 01:27:42,https://www.reddit.com/r/tirzepatidecompound/comments/1kseqzo/waterpark_nsv/,"I was at an indoor waterpark with my family yesterday. They have this big ride where the tube is like a four leaf clover (made for four people) and the heaviest person has to ride going backwards down the slide. The worker guesstimates who’s the heaviest and makes them sit there (it was always me in years past). I was with my teenage son (just me and him riding the ride) who is very tall, skinny, and lanky and they made him go backwards! He was happy about it and so was I. 🥺",tirzepatidecompound
Best Diesel To Daily?,1,0,2025-05-22 01:27:42,https://www.reddit.com/r/CarTalkUK/comments/1kseqzn/best_diesel_to_daily/,"
Hi guys,

I’m looking at buying my first diesel as my commute is 40+miles each way - basically all a12 dual carriage way. 

I’m currently doing it in a 1.4 petrol but it’s starting to really hurt doing £30 in petrol every 2 days. Plus the wear on the way.

What litre diesel should I be looking at? 1.6 sports? 1.8’s? 2.0’s? 

Open to anything - Thanks guys! ",CarTalkUK
What do you think of this?,1,1,2025-05-22 01:27:42,https://www.reddit.com/gallery/1kseqzp,It says on the back “ this autograph is guaranteed by Panini” but there is no autograph. ,footballcards
Oh God...,1,1,2025-05-22 01:27:42,https://www.reddit.com/gallery/1kseqzt,,ChatGPT
"Loona being bi is awesome, but IMO she should be kept single.",1,0,2025-05-22 01:27:42,https://www.reddit.com/r/hazbin/comments/1kseqzu/loona_being_bi_is_awesome_but_imo_she_should_be/,"I feel really nervous to say this, as I am worried that people will be pissed at me, especially since this is coming from someone who is straight and a huge Loona fan. But please hear me out:

First of all, I just want to say that I really am happy that Loona is bi. It's nice to see that this show prioritizes queer rep.

However, I do have concerns about putting her in a canon relationship, and why in my opinion, she should be kept single.

Think about it this way:

1. Even if Loona is part of the LGBTQ community, it doesn't erase the fact that she still has a LARGE fanbase, especially within the furry fandom. When this character was first introduced, many people were obsessed with her in the furry fandom, particularly guys. It might not have been her original intention, but this is just what happens to most female furry characters in general (e.g. Lola Bunny from Space Jam).

Now I know that the furry fandom is predominantly LGBTQ as well, and that the gender of the fan is irrelevant to their love for characters like Loona. However, it doesn't change the fact that these kinds of crushes are still common within the fandom, and that if straight people can enjoy them, then so can queer fans. Therefore, if Loona already has a predominant fanbase, it makes sense to keep her single so that she can continue to be popular among both Hellaverse fans and the furry community, because both straight and queer fans crush on her all the same.

2. There's already enough relationships as is. People often forget this, but being queer and being in a relationship are not the same thing. In fact, some characters like Octavia or Mammon are ace themselves. Also, since relationships like Stolitz and Ozzie x Fizz are already well-done as queer rep (and given that there are also heterosexual relationships like Vortex x Bee, and Moxxie and Millie), it already makes sense to avoid forcing Loona into such a relationship, especially since she's just 22, and is already the daughter of Blitzo, a character who is already focused on his OWN relationship with Stolas, which has yet to be fully completed in the show.

3. Lastly, we already have bi women in sapphic relationships in this type of media. Not to say that we DON'T need more of them, but the way the Hellaverse in general does this is already perfect enough. In Hazbin Hotel, for example, the protagaonist Charlie Morningstar is bi, and she's in a relationship with Vaggie (who is lesbian). Not only is this important, but given that it avoids ANY stereotypes, and given that Charlie is less of a ""fanservice-y"" character compared to Loona, it makes sense here, and their romance is very well done. Also, if you didn't realize already, animated media has done this before. Think of Luz and Amity in Owl House for example, or Enid and Rose in OK KO! Let's Be Heroes! Oh, and if you were looking at the pride merch recently, you may have learned that Mayberry and Martha are lesbian and bisexual respectively. If that's not good sapphic rep involving a bisexual character in Helluva Boss, I don't know what is.

In conclusion, representation is important, yes. But not all characters need to be in relationships, and certainly not Loona. Even characters like Barbie Wire, Verosika, or even Sallie May, *they* aren't in relationships either, and they're still happily and openly queer! And considering the immense popularity of Loona, both in and out of the Hellaverse fandom, a relationship just wouldn't work for her character, and could still alienate fans on both sides. So while it's fun to speculate, canon still matters, and given that Loona is more of a side character than a main character (that would be Blitzo, of course), I'd say let her stay single. Sometimes, the best queer rep is one without a relationship.",hazbin
Yang,1,0,2025-05-22 01:27:42,https://www.reddit.com/gallery/1kseqzx,"Yang passed away in December due to cancer. She was always the cuddliest out of all my rats. I believe she was an Angel sent down form heaven to protect her little sister from her demonic older sister. 🐀 Just wanna spread her cuteness all over Reddit and found this photo pretty silly. 

Ps please ignore my chest in my last picture. I’m slightly allergic to rats. ",RATS
Why do people protect women that is getting attacked or r@ped? If a men was getting attacked or r@ped would they protect the men?,1,0,2025-05-22 01:27:42,https://www.reddit.com/r/antifeminist/comments/1kseqzy/why_do_people_protect_women_that_is_getting/,See I always see those corny wannabe serial killer and edgy save Europe kids post on their honest reaction when a women gets attacked or r@ped or those save Europe kids complaining about women getting r@ped by an immigrant (sorry for my bad English). What I ask if will they do to the same to the men. They would also protect the men from those kind of things since I always see on comment section of women rapist on news that they also dreamed of getting r@ped by that rapist women too or that the man who got r@ped by the women is lucky. I literally hate when they protect women. And say men go to war.,antifeminist
Got Nike socks under $0.56—seriously can’t believe how good they feel.,1,1,2025-05-22 01:27:42,https://docs.google.com/spreadsheets/d/e/2PACX-1vTnt-y8bTcBLKa-FtqjFP7fkfRR6T0k7TmSLKbzRLBVLyupQ705j9oEseLo2jmrlqTAItN9Ocw1K-Ov/pubhtml,,1to1reps
ITAP of the Grand Canyon of Yellowstone,1,1,2025-05-22 01:27:41,https://i.redd.it/m7rotqihk82f1.jpeg,,itookapicture
I just got a new pc yesterday and when I turn it back on its a grey screen with a blue loading curser,1,1,2025-05-22 01:27:41,https://www.reddit.com/r/WindowsHelp/comments/1kseqzi/i_just_got_a_new_pc_yesterday_and_when_i_turn_it/,"The PC I have is Thermaltake - LCGS View i460T V2 Gaming Desktop Intel Core i7- 14700F, 32GB DDR5 RAM, NVIDIA GeForce RTX 4060 Ti, 1TB NVMe M.2 - White, I dont know anything about PC’s I have no idea what to do. I followed some instructions and it got me to the log in but I have to put my pin, but it says something happened to my pin and its not allowing me to set up a new one.",WindowsHelp
