title,score,comments,created,url,selftext,subreddit
I can’t seem to stop asking questions and feel selfish,1,1,2025-05-22 01:28:02,https://www.reddit.com/r/AsOneAfterInfidelity/comments/1kser8j/i_cant_seem_to_stop_asking_questions_and_feel/,"It’s been 2.5 weeks since DDay and I keep asking questions about the month long affair my spouse had and the foundation he had built before that/ flirting for months because you don’t just randomly meet a coworker and end up kissing them. He is sorry he hurt me and recognized what he did was wrong. But everytime I want to discuss when he was seeing someone else or something along the lines of why he couldn’t tell me immediately after the first kiss happened it reminds him of how rock bottom our marriage had hit. It reminds him of how he was unseen, neglected and treated badly by me. He said he at the time didn’t care about what repercussions his actions would have on our marriage and potentially wanted to be seen by someone. I feel terrible for asking him about why/ how / what happened every single day. I feel selfish for not being able to move past it. I feel like the bad guy for asking the questions and that I neglected him …. ",AsOneAfterInfidelity
"TNT presents “Going Inside,” a tribute to Inside the NBA, quickly followed by a Beyoncé Levi Commercial.",1,0,2025-05-22 01:28:02,https://www.reddit.com/r/billsimmons/comments/1kser8f/tnt_presents_going_inside_a_tribute_to_inside_the/,Horny page 2 Bill Simmons Christmas. But seriously… who came up with that name???,billsimmons
was it only the non pop-now HAS and MAC that dropped tn?,1,0,2025-05-22 01:28:01,https://www.reddit.com/r/labubu/comments/1kser8d/was_it_only_the_non_popnow_has_and_mac_that/,i never saw pop now go back in stock so did everyone get one tn through the regular blind box item not the pop now ones? ,labubu
You don't want us to fill empty shelf space? Good luck selling air...,1,0,2025-05-22 01:28:01,https://www.reddit.com/r/MaliciousCompliance/comments/1kser8c/you_dont_want_us_to_fill_empty_shelf_space_good/,"Years ago, I worked for a medium-sized retailer which sold all sorts of things, from confectionery to garden supplies. 
The store had half an aisle near the front of the store dedicated to events, which were pretty much right in the customers' faces as they entered the store. 

Every few weeks, these event shelves would change over to a new department, or be themed to any upcoming holidays or special days, such as Mother's Day or Halloween.

Usually for these events, we would get the stock delivered the week before, and spend that week taking out the old stock and replacing it with the new lines. If a new line was missing from the delivery, we'd go and find a different line that would fit into that event from elsewhere in the store.

One day in early April, we received an email from upper management:

""Do not replace missing event lines with any other lines."" 

We emailed back to clarify, because of course, nearly every event delivery is missing at least one line. Do they want us to spread other items out to fill the empty space, or what?

""Just leave the space for any missing lines empty. It will look like they have sold out.""

Barely a month later, while preparing for the Mother's Day event, we receive our regular delivery, with no Mother's Day event lines - not one. So we email upper management to let them know that we haven't received any of the event lines.

""They will come on your next delivery. Do not fill empty space.""

Well, they did not arrive on the next delivery either. We emailed them again, informing them that we had still not received any event lines, and heard nothing back, so we decided to do exactly what they asked. We cleared out the old event lines, and left the entire event section completely empty, for the entire 3 week period leading up until Mother's Day.

After Mother's Day, during a conference call (a group call between upper management and all the store managers for the region), they asked us why we had zero sales for the event lines, and why our sales for the period had dropped significantly. We just referred them back to other previous emails where we told them that we never received the delivery, and they had said not to fill missing lines. Cue the most deliciously sweet awkward silence.

After the call, one more email was sent out to everyone:

""Please use your best judgement when filling missing lines for events.""",MaliciousCompliance
Which classic works talk about greed?,1,0,2025-05-22 01:28:01,https://www.reddit.com/r/literature/comments/1kser89/which_classic_works_talk_about_greed/,"I’m referring to fictional books like *The Iliad*, *The Odyssey*, Shakespeare, or *Don Quixote*—stories where greed is one of the central themes.

Don’t hesitate to mention any of the ones I already listed. I’m not an expert in classic literature.  
I’m all ears!",literature
"Hi, has anyone actually felt traumatized from a bad treatment?",1,0,2025-05-22 01:28:01,https://www.reddit.com/r/Spravato/comments/1kser88/hi_has_anyone_actually_felt_traumatized_from_a/,,Spravato
[pretty blood],1,0,2025-05-22 01:28:01,https://i.redd.it/5ymtyjljk82f1.png,[design Dax differently],PrettyBloodFans
Why do people say we don’t respect allergies?,1,0,2025-05-22 01:28:01,https://www.reddit.com/r/vegan/comments/1kser85/why_do_people_say_we_dont_respect_allergies/,"Every time veganism comes up online, if they’re not saying we’re preachy holier-than-thou jerks, they’re saying we feed them allergens without empathy and I just don’t get it.

I can think of a bajillion vegan meals right now off the top of my head that have no nuts or soy or gluten. I don’t understand why everyone online has a traumatic experience with a vegan feeding them allergens.

That said, if someone couldn’t handle legumes, nuts, gluten or soy, I genuinely wouldn’t know how to help them at that point lol. Maybe mushroom protein?",vegan
Snakebites still excreting discharge,1,0,2025-05-22 01:28:01,https://www.reddit.com/r/piercing/comments/1kser83/snakebites_still_excreting_discharge/,Got my snakebites done in March. The left one healed perfectly but the right one is still excreting discharge and I'm still getting crusties from it. No pain or soreness,piercing
Is anyone else starting to get annoyed how Destiny acts like he is completely disinterested in all topics on 'Anything Else?' when his streams and Tweets show the exact opposite?,1,0,2025-05-22 01:28:01,https://www.reddit.com/r/Destiny/comments/1kser7y/is_anyone_else_starting_to_get_annoyed_how/,"Does he think that adopting this persona of ""not giving a fuck"" will magically prevent him from appearing drama-invested? ",Destiny
Overview for AnaCurlyVibes,1,1,2025-05-22 01:28:01,https://www.reddit.com/user/AnaCurlyVibes,,BotBouncer
tiktok shop laptop,1,0,2025-05-22 01:28:00,https://i.redd.it/u7myz3hjk82f1.jpeg,"hi po. di po ako techy, wala po kong idea sa mga specs. anong thoughts niyo po rito? for zoom meetings, browsing and MS use lang po. very tight din po yung budget kaya dyan po ako nag reresort. thank you po! ",Tech_Philippines
How to approach my GM about the new campaign.,1,1,2025-05-22 01:28:00,https://www.reddit.com/r/rpg/comments/1kser7f/how_to_approach_my_gm_about_the_new_campaign/,"Starting a new campaign,  and it is supposed to be more RP heavy than our last. Last time I tried to leave my character's background open enough to work with the setting since I wasn't familiar with it (1e homebrew). I was basically a third wheel while nearly every other character got to have their backgrounds worked into the campaign at some point. I didn't mind, per se, since it was more combat focused, but after the first couple of years I was kinda checked out for the story parts since being a druid restoring order was all the character was, no bigger stakes. I like the group so I want to have a character who has a bigger reason to be invested besides 'do good things.' 

Unfortunately I am terrified of coming across as having main character syndrome. I really don't, I just want at least something from the character's history to tie into the campaign somewhere. I have plenty of ideas to tie my character in, but I don't want to give too much. I don't want to describe my character in case they post here, but I thought of fleshing out some backstory characters in order to provide possible plot hooks for them. 

Suggestions for approaching this without sounding like I'm criticizing the DM or come across as a spotlight hog?",rpg
does anyone one know this riddle about the callahans?,1,0,2025-05-22 01:28:00,https://i.redd.it/7en2okdhk82f1.png,,RobloxWildWest
'Unquestionably in violation': Judge says US government didn't follow court order on deportations,1,0,2025-05-22 01:28:00,https://apnews.com/article/deportation-immigration-south-sudan-department-of-homeland-security-a09612dbd055c5d1d88902c415bdf3e6,,conservativeterrorism
Rubber strap with clasp for Carrera?,1,0,2025-05-22 01:28:00,https://i.redd.it/y33qpadjk82f1.jpeg,Anyone have recommendations for rubber strap with clasp for a Carrera Calibre 5? Ideally Tag would make one that fits but I haven’t found anything yet. ,tagheuer
What is this plant growing inside my cabin?,1,1,2025-05-22 01:28:00,https://www.reddit.com/gallery/1kser7s,"Found him growing out of the walls in my room. I live in Appalachian North Carolina, at about 3,500ft. Sorry for shitty pictures.",whatsthisplant
Não podemos deixar que o Brasil retrocessa desse jeito,1,0,2025-05-22 01:28:00,https://www.reddit.com/r/brasilivre/comments/1kser7t/não_podemos_deixar_que_o_brasil_retrocessa_desse/,"""PL da Devastação"" https://pldadevastacao.org
Se o PL da devastação for aprovado permitirá que grandes empreendimentos sejam construídos SEM a necessidade dos estudos que visam garantir a saúde e o bem-estar de pessoas e ecossistemas. Vote contra o Pl da devastação para que a voz do nosso povo seja reconhecida e OUVIDA! Vote para que a natureza não tenha seus limites ultrapassados, para que os povos locais não sejam imensamente prejudicados e que a segurança dos biomas do Brasil e do povo rasileiro NÃO seja rompida! ",brasilivre
Yall fucking weird,1,0,2025-05-22 01:27:59,https://www.reddit.com/r/kanyewest/comments/1kser7c/yall_fucking_weird/,,kanyewest
Important:  kya har saal clg k cutoffs same rhte h??kyuki iss saal bache bdhe h toh har %ile pe jada students honge ??,1,1,2025-05-22 01:27:59,https://www.reddit.com/r/mht_cet/comments/1kser7b/important_kya_har_saal_clg_k_cutoffs_same_rhte/, kya har saal clg k cutoffs same rhte h??kyuki iss saal bache bdhe h toh har %ile pe jada students honge ??,mht_cet
Wait real??,1,0,2025-05-22 01:27:59,https://www.reddit.com/gallery/1kser7a,Didn’t even have a chance lmfao ,ArenaBreakoutGlobal
Tiefling commission Had fun coloring her,1,1,2025-05-22 01:27:59,https://www.reddit.com/gallery/1kser79,,DnDart
Will doing this box dye over henna ruin my hair for future henna?,1,0,2025-05-22 01:27:59,https://www.reddit.com/gallery/1kser77,Is it too dark? Will I be trapped with box dyes and/or darker colors forever? I currently have copper henna in my hair over a salon dyed light auburn with gray and dark blonde/light brown roots starting to grow out. Trying to decide whether to just stick w henna or do this fun color when I cut my hair (my roots still have some greenish tones from previous vivid color- that will be chopped off). TIA!,AskHairstylists
THE MONSTERS FALL IN WILD SERIES-Vinyl Plush Doll Pendant - $30.99 at Pop Mart,1,0,2025-05-22 01:27:59,https://www.reddit.com/r/LabubuRestocks/comments/1kser74/the_monsters_fall_in_wild_seriesvinyl_plush_doll/,"**Link**: https://www.popmart.com/us/products/1061 - 05/21/25 08:27 PM CST

- Want faster pings and more monitors? Join our Discord! https://whop.com/omg-alerts/",LabubuRestocks
Marty Friedman en Argentina!,1,0,2025-05-22 01:27:59,https://i.redd.it/gcj1t18xj82f1.jpeg,"El ex-guitarrista de Cacophony, Megadeth y Tourniquet vuelve a la Argentina en su gira Live Drama 2025... Imperdible!!! ",RecitalesRockBA
Used lawnmower,1,0,2025-05-22 01:27:59,https://www.reddit.com/r/missoula/comments/1kser70/used_lawnmower/,Does anyone have a used gas lawnmower for sale or know where I can find one?,missoula
Fade spot Houston (Montrose),1,0,2025-05-22 01:27:58,https://www.reddit.com/r/houston/comments/1kser6u/fade_spot_houston_montrose/,"Hey guys , new here to Houston looking to get a nice mid drop fade. There’s not too much social media presence online about the shops and their work (especially specific barbers). Tryna find a spot that knows all the recent trends and does a nice mid drop fade aswell as a a beard line up near montrose area. Any info would help on shops and even specific barbers if you know.",houston
Need help identifying for repair.,1,0,2025-05-22 01:27:58,https://www.reddit.com/gallery/1kser6q,"I just picked up 2 new pens at a thrift store. Based on my research, this one is a Parker Duofold, but upon further research there seems to be many different versions of the duofold, so I would like help properly identifying it to buy the correct ink sac for it. It is button filling, the bar and button seem to be working properly, but the ink sac was dried up and deformed, so I believe that is all I need to replace. The clip also seems to be a little looser than I would like, but I cant figure out how to remove it for cleaning, if someone can guide me in the right direction. And the section seems to be a little loose when attaching to the barrel if anyone can share suggestions on how to get a tighter fit. If anyone would like additional pictures or details about the pen, I will provide them.",fountainpens
Menthol Cigarettes,1,0,2025-05-22 01:27:58,https://www.reddit.com/r/waterloo/comments/1kser6t/menthol_cigarettes/,"Hi, is there any places that sell menthol cigarettes? I know its banned and stuff, but like, I see a lot of people that have them, I'm tryna get myself a pack too. Do you know any place that sells it? ",waterloo
LABUBU × PRONOUNCE - WINGS OF FORTUNE Vinyl Plush Hanging Card - $43.99 at Pop Mart,1,0,2025-05-22 01:27:58,https://www.reddit.com/r/LabubuRestocks/comments/1kser6v/labubu_pronounce_wings_of_fortune_vinyl_plush/,"**Link**: https://www.popmart.com/us/products/1584 - 05/21/25 08:27 PM CST

- Want faster pings and more monitors? Join our Discord! https://whop.com/omg-alerts/",LabubuRestocks
Dumb question about DLC,1,0,2025-05-22 01:27:58,https://www.reddit.com/r/ReadyOrNotGame/comments/1kser6y/dumb_question_about_dlc/,"Howdy. I’m a console player (no this isn’t a when is it releasing question lol) 

I had a question on how the dlc worked for RoN before me and a buddy bought the game.

To play the dlc do we both need to buy it or can one of us buy it and the other piggy back off the buyer ? 

Thanks a million in advance y’all 

",ReadyOrNotGame
Lakers get size Memphis gets assets and magic get shooting,1,0,2025-05-22 01:27:58,https://i.redd.it/bxmkiruik82f1.jpeg,,NBAtradeideas
Speeding Citation in Ohio effect on Texas driving record?,1,0,2025-05-22 01:27:58,https://www.reddit.com/r/DMV/comments/1kser6w/speeding_citation_in_ohio_effect_on_texas_driving/,"First offense. Recently was issued a speeding ticket for going 16 mph over on a highway. This level would be 2 points on my record according to the Ohio county website. However, I am a Texas resident, and Texas had done away with its point system back in 2020.

How will this Ohio ticket impact my Texas driving record and insurance rate for my car in Texas?",DMV
Negligencia Clinica de Occidente,1,0,2025-05-22 01:27:57,https://www.reddit.com/r/Bogota/comments/1kser6m/negligencia_clinica_de_occidente/,"Hola comunidad. Sucede que desde octubre estoy en un proceso de diagnóstico de un tejido blando que me salió en mi seno. Después de un largo proceso en citas, exámenes y autorizaciones de la EPS por fin había logrado un diagnóstico y programación de cirugía para este mes (agendada desde hace dos meses).

Un día anterior a la cirugía  me llaman para informar que me cancelan la cirugía con la excusa  de que no tienen salas disponibles para el procedimiento y tras del hecho no me ofrecen como alternativa reubicar o reagendar la cirugía sino hasta una próxima fecha en la que ellos llaman para confirmar. 

Me gustaría preguntar si este acto, que a mi parecer es arbitrario, está avalado por la ley Colombiana o si por el contrario vulnera mi derecho de salud de una atención continua y oportuna y cómo podría proceder para agilizar o reclamar por mi procedimiento el cual ya estaba programado.

Si bien soy afiliada como contribuyente en Compensar EPS, la Clínica de Occidente es quien ha realizado todo el proceso desde el diagnóstico hasta la realización del procedimiento de la cirugía. 

De antemano gracias por sus comentarios.

",Bogota
I’m trying to sign up but it won’t let me click the “enroll now” button does anyone know why?,1,0,2025-05-22 01:27:57,https://i.redd.it/iplxuu6jk82f1.jpeg,,Sparkdriver
Get 3 months of Full Self-Driving (Supervised) or $400 of solar Panel Installation! This offer applies to all S3XY models and Cybertruck orders,1,0,2025-05-22 01:27:57,https://www.reddit.com/r/TeslaReferralCodesNow/comments/1kser6d/get_3_months_of_full_selfdriving_supervised_or/,Use my referral link : https://www.tesla.com/referral/jiaming404331 - Feel free to DM me if you have any questions.,TeslaReferralCodesNow
Looking for input on range finder,1,0,2025-05-22 01:27:57,https://i.redd.it/qzairq4jk82f1.png,"Does any body have this in their bag?  Or have used this... I'm looking for one with slope, easy to hit target and price. Any feedback would be helpful ",golf
"Anarchist News Review: Labour U-turns, wild camping and the PKK's end | Freedom News",1,0,2025-05-22 01:27:56,https://freedomnews.org.uk/2025/05/22/anarchist-news-review-labour-u-turns-wild-camping-and-the-pkks-end/,,worldanarchism
"M 190lbs, 5’10 4 weeks of cutting",1,0,2025-05-22 01:27:56,https://www.reddit.com/gallery/1kser5w,,Physiquecritique
The Pickle Back conversation reminded me of this,1,0,2025-05-22 01:27:56,https://www.youtube.com/watch?v=XqLjzBC06p0&ab_channel=Tosh.0,I miss Tosh.0,PaymoneyWubby
how would you compare the 2016 Penguins and the 2025 Oilers,1,0,2025-05-22 01:27:56,https://www.reddit.com/r/nhl/comments/1kser5y/how_would_you_compare_the_2016_penguins_and_the/,"they seem to have a lot in common , starting with their style of play. maybe I'm wrong",nhl
Black Cat,1,0,2025-05-22 01:27:56,https://i.redd.it/vzndp84jk82f1.png,Let's play find the cat.,cats
Best defensive Day,1,0,2025-05-22 01:27:56,https://i.redd.it/32o9mv3jk82f1.jpeg,First time defending 8 different players. Has the defensive tribes made a difference for anyone else recently? ,BoomBeach
Repair or Get New Unit?,1,0,2025-05-22 01:27:56,https://www.reddit.com/r/geothermal/comments/1kser67/repair_or_get_new_unit/,"Hello,

I am pretty new to geothermal. We moved into a house less than a year ago, and one of the selling points was the geothermal unit. It is an old house, built 1900, with generally poor insulation. The geothermal unit was installed in 2008.

We were having problems with cooling, called for inspection, which determined that the cooling coils in the unit had a leak. The refrigerant is all gone, and a leak is audible when  pressurized. The technition said that with a unit this old, finding the coil part would be at least $5000, if they can even find a part to fit this old unit. There also seems to be a problem with the hook-up to the water tank, as a back-up water heater.

A new unit is going to cost at least $17,000. I know there will be some amount of rebate. The tax credit is less appealing since we don't normally pay that much in taxes. 

Will we really be saving that much money in the long run? Especially since we'll likely need to get a loan to pay for it, including the interest.

Should we push for just repairing it and the various piece, whack-a-mole, or should is a new, more efficient unit worth it? ",geothermal
Reuben,1,0,2025-05-22 01:27:56,https://www.reddit.com/gallery/1kser69,"Added provolone, mushrooms, red onion and light sauerkraut. ",Sandwiches
Help me mod my 1982 Opel Ascona Luxus C 1.6L,1,0,2025-05-22 01:27:56,https://www.reddit.com/r/Cartalk/comments/1kser5z/help_me_mod_my_1982_opel_ascona_luxus_c_16l/,"Hi guys,

I am not that familiar with modding when it comes to cars but I own the car that's in the title, and I want to start modifying it (not heavily).

It currently runs on 75hp, with a 4 gear transmission (will upgrade the trans to at least 5).

What are some recommendations? I was thinking of engine swapping to a C20LET 2.0L Turbocharged, though I can't find it anywhere yet.

I'm a Dutch student, so my budget isn't very high though I would love to hear some ideas and possibilities!

The car's in great condition, has basically no rust except for at the back window and front windshield underneath the window rubbers. I found someone who will fix this for me so then the car is in neat condition except for a few body marks that I will manage later on.

I appreciate the people that will respond to this!",Cartalk
Only in Crusader Kings 3,1,0,2025-05-22 01:27:55,https://i.redd.it/vcqpgnb5k82f1.png,"R5: This is an older save file so my memory's a bit fuzzy on how it happened but from what I remember after the Mongols broke up I noticed that within one life time (the guy in the picture) the empire of Chagatai had turned into a theocrasy seemingly out of nowhere (don't ask for more context, this all happened while I was not looking)",crusaderkings3
"Lord give me strength, Galactus calls me",1,0,2025-05-22 01:27:55,https://i.redd.it/y7otgoxik82f1.jpeg,,MarvelSnap
Hurt wing?,1,0,2025-05-22 01:27:54,https://www.reddit.com/gallery/1kser5j,"Hi 
I’m worried about Mavis’ wing. She’s normal and happy and flys around fine, but her right wing seems dropped more than the left. I don’t remember this happening but it’s been about a month or so. 
Could it be hurt/should I take it to a vet?
Thanks
They were unevenly cut from a baby so we tried to get them more even, and will let them grow out ",Conures
1-minute mechanical/digital timer with real sound (orig.: Timer 1 minuti meccanico/digitale con suono reale) #1-minute #mechanical/digital,1,0,2025-05-22 01:27:54,https://www.youtube.com/watch?v=zkMqkyGFPXQ,,ItaliaBox
[Crosspost] what’s do you guys think? can’t put my real age so let’s just say i just got my permit. M 5’6 140,1,0,2025-05-22 01:27:54,https://i.redd.it/cipumtxfk82f1.jpeg,,PhysiqueCritiques
Does anyone know the parking rules for W Liberty St/Thomas M Armstrong Blvd?,1,0,2025-05-22 01:27:54,https://www.reddit.com/r/lancaster/comments/1kser5b/does_anyone_know_the_parking_rules_for_w_liberty/,"Hey everyone, I am staying at Franklin and Marshall for the summer and have never been in Lancaster before. Thinking about having a friend or two visit for a couple of days, and was wondering if they can just leave their cars on these two streets? I don't see any clear signs, and I can't find much information online. Thanks!",lancaster
The kind of bs why I love maokai. Support mao or afkfeed pls and ty,1,0,2025-05-22 01:27:54,https://v.redd.it/ht5mrg4ik82f1,,wildrift
New INT 650 - Idle question,1,0,2025-05-22 01:27:54,https://i.redd.it/mjvuna0hk82f1.jpeg,"So I did a thing today. Not my pic but I just rode a 2024 INT 650 (same color, Black Pearl)  home to keep my Triumph Speed 400 company. 20 miles on the clock. It idles at 1100 rpm. It stalled once while slowing down. Any tips?",royalenfield
Ticci Toby Question,1,0,2025-05-22 01:27:54,https://www.reddit.com/r/creepypasta/comments/1kser54/ticci_toby_question/,"SO
im like.. not new but also new to this all if you get what i mean, like when i was younger, i didnt have internet access, so it'd be friends retelling the stories to me, showing me fanart etc what got me into Creepypasta initially, and ive always been attatched to Toby, and ive watched Marble Hornets last year (FREAKING LOVE IT OMG)

from what ive gathered, his original story was taken down, but my main question is why people in memes and short videos etc put Toby in with Masky and Hoodie? was his original story almost like a fanfic or self insert to the story? ive half listened to a youtube video kinda like audio book thingy of a fanfic based on the original story, but gave up because it wasnt the original and didnt answer my question

the friends that got me into Creepypasta either dont like it/remember it anymore, or i dont talk to them anymore, and my current friends arent as into it as i am, like i cosplay Toby, and im working on a closet cosplay of Masky, i just feel so bad being in the dark on this 😭

tysm for reading, here's a cookie 🍪",creepypasta
tips on color order and how to do the yellow/orange sun background?,1,0,2025-05-22 01:27:54,https://www.reddit.com/gallery/1kser52,"got this beautiful nine colored deer stamp and want to make one like the photos. white deer, blue ribbon, purple background. i can paint the small details but the large sun background is shallow and wide. im pretty new and need to practice more, but maybe some tips can help speed it along! i did white, blue(glue mixed with wax), then purple. but am thinking i should have done the blue first as the deer isnt connected without it. this was my first use of this stamp
so i now know i need more wax as well for the final one",WaxSealers
